{
  "version": 1,
  "appName": "Mon Budget",
  "exportDate": "2026-03-17T10:00:00.000Z",
  "metadata": {
    "totalTransactions": 0,
    "totalBudgets": 1,
    "totalGoals": 0
  },
  "data": {
    "transactions": [],
    "budgets": [
      {
        "month": "2026-02",
        "amount": 200
      }
    ],
    "goals": []
  }
}
