{
  "version": 1,
  "appName": "Mon Budget",
  "exportDate": "2026-03-17T10:00:00.000Z",
  "metadata": {
    "totalTransactions": 2,
    "totalBudgets": 1,
    "totalGoals": 1
  },
  "data": {
    "transactions": [
      {
        "id": 1,
        "type": "expense",
        "amount": 12.50,
        "category": "Alimentation",
        "date": "2026-03-10",
        "createdAt": "2026-03-10T08:00:00.000Z"
      },
      {
        "id": 2,
        "type": "income",
        "amount": 50,
        "category": "Argent de poche",
        "date": "2026-03-01",
        "createdAt": "2026-03-01T08:00:00.000Z"
      }
    ],
    "budgets": [
      {
        "month": "2026-03",
        "amount": 150
      }
    ],
    "goals": [
      {
        "id": 1,
        "name": "Nouveau vélo",
        "target_amount": 80,
        "current_amount": 20,
        "achieved": false,
        "createdAt": "2026-03-01T08:00:00.000Z"
      }
    ]
  }
}
