{
  "version": 1,
  "appName": "Mon Budget",
  "exportDate": "2026-03-17T10:00:00.000Z",
  "metadata": {
    "totalTransactions": 0,
    "totalBudgets": 0,
    "totalGoals": 1
  },
  "data": {
    "transactions": [],
    "budgets": [],
    "goals": [
      {
        "id": 1,
        "name": "Nouveau vélo",
        "target_amount": 80,
        "current_amount": 20,
        "achieved": false,
        "createdAt": "2026-03-01T08:00:00.000Z"
      }
    ]
  }
}
